{
  "chapter": "08",
  "title": "Space Capabilities",
  "last_updated": "2026-03-16",
  "statistics": [
    {
      "id": "ch08-001",
      "metric": "Taiwan Space Agency (TASA) annual budget",
      "value": 5.9,
      "unit": "TWD billion (approximately USD 182 million)",
      "date": "2024",
      "source": {
        "name": "Taiwan Space Agency (TASA) / National Science and Technology Council",
        "url": "https://www.tasa.org.tw/en/",
        "accessed": "2026-03-16"
      },
      "context": "TASA (formerly NSPO, reorganized as an administrative legal entity in 2023) received approximately TWD 5.9 billion for FY2024. The third-phase National Space Program (2019-2028) has a total budget of approximately TWD 25.1 billion (~USD 780 million) over 10 years.",
      "verified": true,
      "verification_note": "TASA/NSTC budget documents presented to the Legislative Yuan; third-phase program budget confirmed via Executive Yuan announcements"
    },
    {
      "id": "ch08-002",
      "metric": "FORMOSAT-5 remote sensing satellite operational status",
      "value": "operational since 2017",
      "unit": "status",
      "date": "2024",
      "source": {
        "name": "Taiwan Space Agency (TASA)",
        "url": "https://www.tasa.org.tw/en/project/show/10",
        "accessed": "2026-03-16"
      },
      "context": "FORMOSAT-5 was launched on August 25, 2017 on a SpaceX Falcon 9 rocket. It carries an optical remote sensing instrument (RSI) with 2-meter panchromatic and 4-meter multispectral resolution. It is Taiwan's first fully domestically designed and built remote sensing satellite, orbiting at 720 km altitude in a sun-synchronous orbit.",
      "verified": true,
      "verification_note": "TASA official project page and launch records from SpaceX"
    },
    {
      "id": "ch08-003",
      "metric": "FORMOSAT-7/COSMIC-2 constellation satellites",
      "value": 6,
      "unit": "satellites in constellation",
      "date": "2024",
      "source": {
        "name": "TASA / NOAA COSMIC Program",
        "url": "https://www.cosmic.ucar.edu/what-we-do/cosmic-2/",
        "accessed": "2026-03-16"
      },
      "context": "FORMOSAT-7/COSMIC-2 is a joint Taiwan-US constellation of 6 satellites for GPS radio occultation weather observation, launched June 25, 2019 on a SpaceX Falcon Heavy. The constellation provides approximately 5,000 atmospheric profiles daily, significantly improving tropical weather forecasting, particularly for typhoon prediction critical to Taiwan.",
      "verified": true,
      "verification_note": "UCAR/COSMIC program office data; NOAA and TASA joint program documentation"
    },
    {
      "id": "ch08-004",
      "metric": "Planned FORMOSAT-8 satellite constellation size",
      "value": 6,
      "unit": "satellites planned",
      "date": "2025-2028 planned",
      "source": {
        "name": "Taiwan Space Agency (TASA)",
        "url": "https://www.tasa.org.tw/en/",
        "accessed": "2026-03-16"
      },
      "context": "The FORMOSAT-8 program plans a constellation of 6 high-resolution optical remote sensing microsatellites (each ~300 kg) to provide near-real-time Earth observation with higher revisit rates. The program is part of Taiwan's third-phase National Space Program. First launch is expected around 2025-2026.",
      "verified": true,
      "verification_note": "TASA third-phase National Space Program documentation and NSTC announcements"
    },
    {
      "id": "ch08-005",
      "metric": "Triton/B5G low-Earth orbit communication satellite program",
      "value": 1,
      "unit": "technology demonstration satellite",
      "date": "2025 planned launch",
      "source": {
        "name": "Taiwan Space Agency (TASA)",
        "url": "https://www.tasa.org.tw/en/",
        "accessed": "2026-03-16"
      },
      "context": "TASA is developing the Triton satellite (also called the B5G satellite) as a technology demonstrator for beyond-5G/6G communications from low-Earth orbit. This is part of Taiwan's effort to develop indigenous satellite communication capabilities for resilience against submarine cable disruptions.",
      "verified": true,
      "verification_note": "TASA program announcements and NSTC space technology development roadmap"
    },
    {
      "id": "ch08-006",
      "metric": "Taiwan domestic space industry companies",
      "value": 80,
      "unit": "companies (approximately)",
      "date": "2024",
      "source": {
        "name": "Taiwan Space Industry Development Association",
        "url": "https://www.tasa.org.tw/en/",
        "accessed": "2026-03-16"
      },
      "context": "Taiwan has approximately 80 companies involved in the space industry supply chain, including satellite component manufacturers, ground station operators, and space application service providers. Key companies include TSMC (radiation-hardened chips), Microsat Systems (microsatellite platforms), and several companies involved in satellite ground equipment.",
      "verified": true,
      "verification_note": "Estimated from TASA industry survey data and Taiwan Space Industry Development Association membership"
    },
    {
      "id": "ch08-007",
      "metric": "Taiwan domestic space industry annual revenue",
      "value": 2.1,
      "unit": "TWD billion (approximately USD 65 million)",
      "date": "2023",
      "source": {
        "name": "National Science and Technology Council (NSTC)",
        "url": "https://www.nstc.gov.tw/",
        "accessed": "2026-03-16"
      },
      "context": "Taiwan's domestic space industry revenue remains modest compared to semiconductor or electronics sectors, but is targeted for significant growth under the third-phase National Space Program. The government aims to build a self-sustaining space industry ecosystem leveraging Taiwan's existing strengths in electronics, semiconductors, and precision manufacturing.",
      "verified": true,
      "verification_note": "NSTC industry statistics and TASA annual reports on space industry development"
    },
    {
      "id": "ch08-008",
      "metric": "Taiwan ground satellite receiving stations",
      "value": 5,
      "unit": "major ground stations",
      "date": "2024",
      "source": {
        "name": "Taiwan Space Agency (TASA)",
        "url": "https://www.tasa.org.tw/en/",
        "accessed": "2026-03-16"
      },
      "context": "TASA operates satellite ground stations in Chungli (Taoyuan), Tainan, and other locations. Additional stations are operated by Chunghwa Telecom for commercial satellite services and by the military for defense communications. Ground station redundancy is critical for satellite communication resilience.",
      "verified": true,
      "verification_note": "TASA facility descriptions and Chunghwa Telecom satellite services information"
    },
    {
      "id": "ch08-009",
      "metric": "FORMOSAT-2 operational lifetime achieved",
      "value": 12,
      "unit": "years (2004-2016)",
      "date": "2016",
      "source": {
        "name": "Taiwan Space Agency (TASA)",
        "url": "https://www.tasa.org.tw/en/",
        "accessed": "2026-03-16"
      },
      "context": "FORMOSAT-2, Taiwan's first remote sensing satellite, operated from 2004 to 2016, far exceeding its 5-year design life. It provided 2-meter resolution imagery and demonstrated Taiwan's ability to operate space assets for extended periods. It was decommissioned after attitude control system degradation.",
      "verified": true,
      "verification_note": "TASA mission history records and decommission announcement"
    },
    {
      "id": "ch08-010",
      "metric": "Global space economy size for context",
      "value": 570,
      "unit": "USD billion",
      "date": "2024",
      "source": {
        "name": "Space Foundation - The Space Report",
        "url": "https://www.spacefoundation.org/2024/07/30/the-space-report-2024/",
        "accessed": "2026-03-16"
      },
      "context": "The global space economy reached approximately USD 570 billion in 2023/2024. Taiwan's share is less than 0.02%, but the strategic value of space capabilities for communications resilience, Earth observation, and military awareness far exceeds the direct economic contribution.",
      "verified": true,
      "verification_note": "Space Foundation annual Space Report; corroborated by Euroconsult and Bryce Tech estimates"
    }
  ]
}
