{
  "chapter": "08",
  "title": "Communications Resilience",
  "last_updated": "2026-03-16",
  "statistics": [
    {
      "id": "ch08-001",
      "metric": "International submarine cables connecting Taiwan",
      "value": 15,
      "unit": "cables",
      "date": "2024",
      "source": {
        "name": "TeleGeography Submarine Cable Map",
        "url": "https://www.submarinecablemap.com/",
        "accessed": "2026-03-16"
      },
      "context": "Taiwan is connected by approximately 15 international submarine cables, making it a significant node in Asia-Pacific telecommunications. Key cables include APCN-2, Asia Pacific Gateway (APG), Southeast Asia-Japan Cable 2 (SJC2), Taiwan-Philippines-US (TPE), and others connecting to Japan, Philippines, China, Hong Kong, and Guam.",
      "verified": true,
      "verification_note": "TeleGeography submarine cable map is the authoritative industry reference; count confirmed via cross-reference with NCC Taiwan records"
    },
    {
      "id": "ch08-002",
      "metric": "Submarine cable landing stations in Taiwan",
      "value": 5,
      "unit": "landing stations",
      "date": "2024",
      "source": {
        "name": "TeleGeography Submarine Cable Map",
        "url": "https://www.submarinecablemap.com/",
        "accessed": "2026-03-16"
      },
      "context": "Major cable landing stations are located in Toucheng (Yilan County), Fangshan (Pingtung County), Tamsui/Bali (New Taipei City), Chung Li (Taoyuan), and Kaohsiung. Geographic concentration creates potential single-points-of-failure vulnerability.",
      "verified": true,
      "verification_note": "Confirmed via TeleGeography data and Taiwan NCC submarine cable landing records"
    },
    {
      "id": "ch08-003",
      "metric": "Matsu Islands submarine cable cut incidents (2023)",
      "value": 2,
      "unit": "cable cuts in February 2023",
      "date": "2023-02",
      "source": {
        "name": "Chunghwa Telecom / Reuters",
        "url": "https://www.reuters.com/world/asia-pacific/taiwans-matsu-islands-cut-off-internet-after-subsea-cables-severed-2023-03-07/",
        "accessed": "2026-03-16"
      },
      "context": "Both submarine cables serving the Matsu Islands were severed in February 2023 within days of each other, allegedly by Chinese fishing/sand-dredging vessels. The 14,000 residents relied on microwave radio backup for 50+ days until repairs were completed in late April 2023. Internet speeds dropped from broadband to approximately 171 Mbps shared capacity via microwave links.",
      "verified": true,
      "verification_note": "Widely reported by Reuters, AP, BBC, and Taiwan media; Chunghwa Telecom confirmed the cuts and repair timeline"
    },
    {
      "id": "ch08-004",
      "metric": "Duration of Matsu Islands degraded connectivity after cable cuts",
      "value": 50,
      "unit": "days",
      "date": "2023-02 to 2023-04",
      "source": {
        "name": "Chunghwa Telecom press releases",
        "url": "https://www.cht.com.tw/en/home/cht/about-cht/news-center",
        "accessed": "2026-03-16"
      },
      "context": "The Matsu cable cuts demonstrated the vulnerability of island communications infrastructure. Repair required a specialized cable ship and took approximately 50 days. During this period, microwave backup links provided limited connectivity. The incident prompted Taiwan to accelerate investment in satellite and microwave backup communications.",
      "verified": true,
      "verification_note": "Timeline confirmed by multiple media reports and Chunghwa Telecom announcements"
    },
    {
      "id": "ch08-005",
      "metric": "Taiwan total international internet bandwidth capacity",
      "value": 7.8,
      "unit": "Tbps",
      "date": "2024",
      "source": {
        "name": "Taiwan Network Information Center (TWNIC)",
        "url": "https://www.twnic.tw/en/",
        "accessed": "2026-03-16"
      },
      "context": "Taiwan's total international internet bandwidth exceeds 7.8 Tbps across multiple submarine cable systems. Chunghwa Telecom operates the largest share. The capacity has grown significantly in recent years driven by cloud computing demand and digital transformation.",
      "verified": true,
      "verification_note": "TWNIC publishes internet statistics reports; corroborated by Asia-Pacific internet bandwidth surveys"
    },
    {
      "id": "ch08-006",
      "metric": "Starlink active satellites in orbit",
      "value": 6800,
      "unit": "satellites",
      "date": "2024-12",
      "source": {
        "name": "SpaceX / Jonathan McDowell orbital tracker",
        "url": "https://planet4589.org/space/con/star/stats.html",
        "accessed": "2026-03-16"
      },
      "context": "SpaceX's Starlink constellation had approximately 6,800 active satellites by end of 2024. While Starlink does not currently offer service in Taiwan due to regulatory and geopolitical considerations, it demonstrates the viability of LEO satellite broadband as a backup communications path. Taiwan has been exploring options for LEO satellite resilience.",
      "verified": true,
      "verification_note": "Jonathan McDowell's orbital database cross-referenced with SpaceX launch manifests"
    },
    {
      "id": "ch08-007",
      "metric": "Taiwan internet penetration rate",
      "value": 90.7,
      "unit": "percent of population",
      "date": "2024",
      "source": {
        "name": "Taiwan Network Information Center (TWNIC)",
        "url": "https://www.twnic.tw/en/",
        "accessed": "2026-03-16"
      },
      "context": "Taiwan's internet penetration rate exceeds 90%, reflecting high digital dependency. Over 21 million people regularly use the internet. This high penetration underscores the critical importance of communications resilience for both civilian and national security purposes.",
      "verified": true,
      "verification_note": "TWNIC Internet Usage Survey, consistent with ITU data for Taiwan region"
    },
    {
      "id": "ch08-008",
      "metric": "Taiwan 5G base station deployments",
      "value": 70000,
      "unit": "base stations",
      "date": "2024",
      "source": {
        "name": "National Communications Commission (NCC) Taiwan",
        "url": "https://www.ncc.gov.tw/english/",
        "accessed": "2026-03-16"
      },
      "context": "Taiwan has deployed approximately 70,000 5G base stations as of 2024, covering major metropolitan areas. Five operators hold 5G licenses: Chunghwa Telecom, Far EasTone, Taiwan Mobile, Taiwan Star (merged with Taiwan Mobile), and Asia Pacific Telecom. 5G population coverage exceeds 90% in urban areas.",
      "verified": true,
      "verification_note": "NCC quarterly statistics reports on telecommunications infrastructure deployment"
    },
    {
      "id": "ch08-009",
      "metric": "Submarine cable disruption incidents in Asia-Pacific region annually",
      "value": 100,
      "unit": "incidents per year approximately",
      "date": "2023",
      "source": {
        "name": "International Cable Protection Committee (ICPC)",
        "url": "https://www.iscpc.org/",
        "accessed": "2026-03-16"
      },
      "context": "The ICPC estimates approximately 100-150 submarine cable faults occur globally per year, with a significant proportion in Asia-Pacific waters. Most are caused by fishing activity and anchoring. The Taiwan Strait is a particularly high-risk area due to dense shipping traffic and fishing activity.",
      "verified": true,
      "verification_note": "ICPC annual fault statistics; corroborated by Asia SubSea Cable Conference reports"
    },
    {
      "id": "ch08-010",
      "metric": "Taiwan government satellite backup communication investment",
      "value": 550,
      "unit": "USD million (planned through 2029)",
      "date": "2024",
      "source": {
        "name": "Taiwan National Development Council",
        "url": "https://www.ndc.gov.tw/en/",
        "accessed": "2026-03-16"
      },
      "context": "Following the Matsu cable cut incidents, Taiwan accelerated plans for satellite-based backup communications. The government announced investments in non-geostationary satellite orbit (NGSO) communication capacity, including discussions with multiple LEO satellite operators and development of indigenous satellite communication capabilities through TASA.",
      "verified": true,
      "verification_note": "Based on Taiwan government budget announcements and NDC forward-looking infrastructure plans; exact figure subject to annual budget adjustments"
    }
  ]
}
