{
  "chapter": "14",
  "title": "Non-Traditional Security Threats: UAP Investigation, Sensor Integration, and Contact Preparation",
  "last_updated": "2026-03-19",
  "statistics": [
    {
      "id": "ch14-001",
      "metric": "AARO UAP reports received (cumulative through FY2023)",
      "value": 801,
      "unit": "reports",
      "date": "2024",
      "source": {
        "name": "U.S. Department of Defense — AARO",
        "url": "https://www.aaro.mil/",
        "accessed": "2026-03-18"
      },
      "context": "AARO's 2024 annual report to Congress documented 801 cumulative UAP reports (510 from prior years plus 291 new reports in FY2023). Of these, a significant portion remain unresolved after initial analysis. AARO categorizes resolved cases into airborne clutter, natural atmospheric phenomena, USG or industry programs, and foreign adversary systems. The institutionalization of UAP reporting and investigation reflects a paradigm shift toward treating anomalous aerial phenomena as legitimate national security and airspace sovereignty concerns.",
      "verified": true,
      "verification_note": "AARO Annual Report to Congress FY2023; publicly available via AARO.mil"
    },
    {
      "id": "ch14-002",
      "metric": "Countries with formal government UAP investigation programs",
      "value": 6,
      "unit": "countries",
      "date": "2024",
      "source": {
        "name": "NASA UAP Independent Study Team Report / AARO",
        "url": "https://science.nasa.gov/uap/",
        "accessed": "2026-03-18"
      },
      "context": "At least six countries maintain formal government-level UAP investigation programs: the United States (AARO under DoD/DNI), France (GEIPAN/CAIPAN under CNES), the United Kingdom (MoD historical program, renewed interest), Canada (historical and informal ongoing), Brazil (official Air Force program), and Japan (MoD establishing investigation capacity). Several other countries including Australia and Argentina maintain less formal monitoring. The international institutionalization of UAP investigation provides a framework for Taiwan to participate without bearing disproportionate political risk.",
      "verified": true,
      "verification_note": "Cross-referenced from NASA UAP study, AARO reports, CNES/GEIPAN public documentation, and Japan MoD announcements"
    },
    {
      "id": "ch14-003",
      "metric": "NASA UAP Independent Study Team members",
      "value": 16,
      "unit": "independent experts",
      "date": "2023-09",
      "source": {
        "name": "NASA",
        "url": "https://science.nasa.gov/uap/",
        "accessed": "2026-03-18"
      },
      "context": "NASA convened a 16-member independent study team of scientists, engineers, and aerospace experts to examine how NASA could contribute to UAP research using scientific methodology. The team's September 2023 report recommended NASA take a more active role in UAP data collection and analysis, leading to the appointment of a NASA Director of UAP Research. This approach of embedding UAP investigation within a respected civilian scientific institution provides a model for Taiwan.",
      "verified": true,
      "verification_note": "NASA UAP Independent Study Team Report, September 14, 2023; publicly available"
    }
  ]
}
